Product Name,Model,Category,Image(s),Specs,Price (INR),Discount Info,Slide No,Brand,Stock Status,Keywords,Usage Description,cloudinary_url
1/4 Push To Start Auto Shut Off Air Screwdriver,DB-SD-T40PB,Screwdriver,,"Hex Shank Size: 1/4, Screwing Capacity: M2.80-5.00mm, Free Speed (RPM): 1,000, Torque Range: 5-30Kgs/Cm, Overall Length: 7/180mm, Air Inlet (Pt/Npt): 1/4, Air Hose (ID): 1/4, Net Weight: 0.43Kgs / 0.95Lbs",INR 8700.00,25% off,130,Drebon,,"Air Screwdriver, Push To Start, Auto Shut Off, 1/4 inch",An air-powered screwdriver designed for efficient screwing with push-to-start and auto shut-off functionality.,
1/4 Push To Start Auto Shut Off Air Screwdriver,DB-SD-T60PB,Screwdriver,,"Hex Shank Size: 1/4, Screwing Capacity: M4.10-7.00mm, Free Speed (RPM): 550, Torque Range: 15-95Kgs/Cm, Overall Length: 8.1/2/215mm, Air Inlet (Pt/Npt): 1/4, Air Hose (ID): 1/4, Net Weight: 0.77Kgs / 1.70Lbs",INR 23585.00,25% off,130,Drebon,,"Air Screwdriver, Push To Start, Auto Shut Off, 1/4 inch",This 1/4 inch screwdriver features push-to-start and auto shut-off for efficient screwing.,
1/4 Push To Start Auto Shut Off Air Screwdriver,DB-SD-T48PB,Screwdriver,db-i-32.jpg (https://v5.airtableusercontent.com/v3/u/45/45/1759356000000/i0_eq_CrNSvIzE9E4qqrog/04rAZThDJ1kBtmhDS5jYAqMkEH14UiUWongqtG7fJgboKqocWvA1Zbv_jbaKnA0-D4B9JyjozfywrBmYmS5vXaI8qWZKiDylaN6Lfdap6dhO9VesbWl2alXpF-vhpEDjl8QRC9bQnW5zHWiBqGfX6Bn5-Iye9rZ_F0vLcoosrQM/JCDSBzbiJr08BKiYNw1B6nwXg197FYhJBLVmH20_ZeQ),"Hex Shank Size: 1/4, Screwing Capacity: M2.90-6.00mm, Free Speed (RPM): 1,700, Torque Range: 5-45Kgs/Cm, Overall Length: 8.1/2/215mm, Air Inlet (Pt/Npt): 1/4, Air Hose (ID): 1/4, Net Weight: 0.77Kgs / 1.70Lbs",INR 8700.00,25% off,140,Drebon,,"Air Screwdriver, Push To Start, Auto Shut Off, DB-SD-T48PB, 1/4 inch, M2.90-6.00mm, 1700 RPM, 5-45 Kgs/Cm, 8.1/2 inch, 215mm, 0.77Kgs, 1.70Lbs",1/4 Push To Start Auto Shut Off Air Screwdriver,https://res.cloudinary.com/dkse0bpnm/image/upload/v1759342245/viyfzvaxrpjfda98i1la.png
1/4 Push To Start Auto Shut Off Air Screwdriver,DB-SD-T65PB,Screwdriver,db-i-32.jpg (https://v5.airtableusercontent.com/v3/u/45/45/1759356000000/z9v-1U2Wgdf_tFH5aeOMLA/jjnytcVw8KZgHCYjCnVIC0EQnr9tMSNSGF1zsHTc4hBXuzXUckZbX-7cwCNpz9XPt5oc9GVECK1_UoAmipnJstHsuu2uguCqQM24GIEZM3ImSkUU9e8YHRH4mmikDiXOY32amRYD4AiAJMj0K-sNrF-J47nJpcDdiEVoq1HcB6A/k53lujNG58VfVktUAZZa6fVzGo0H3uqhwXGES2c-qFk),"Hex Shank Size: 1/4, Screwing Capacity: M5.00-9.00mm, Free Speed (RPM): 300, Torque Range: 30-180Kgs/Cm, Overall Length: 8.1/2/215mm, Air Inlet (Pt/Npt): 1/4, Air Hose (ID): 1/4, Net Weight: 0.81Kgs / 1.80Lbs",INR 32800.00,25% off,140,Drebon,,"Air Screwdriver, Auto Shut Off, Push To Start",This air screwdriver features a push-to-start mechanism and auto shut-off for efficient screwing.,https://res.cloudinary.com/dkse0bpnm/image/upload/v1759342247/ipnl4iiw0za09vxscfaw.png
1/4 Push To Start Auto Shut Off Air Screwdriver,DB-SD-T50PB,Screwdriver,,"Hex Shank Size: 1/4, Screwing Capacity: M2.90-6.00mm, Free Speed (RPM): 1,400, Torque Range: 7-50Kgs/Cm, Overall Length: 8.1/2/215mm, Air Inlet (Pt/Npt): 1/4, Air Hose (ID): 1/4, Net Weight: 0.77Kgs / 1.70Lbs",INR 10500.00,25% off,140,Drebon,,"Air Screwdriver, Auto Shut Off, Push To Start, 1/4 inch shank",A 1/4 inch push to start air screwdriver with auto shut off functionality.,
1/4 Push To Start Auto Shut Off Air Screwdriver,DB-SD-T68PB,Screwdriver,,"Hex Shank Size: 1/4, Screwing Capacity: M6.00-11.00mm, Free Speed (RPM): 250, Torque Range: 50-280Kgs/Cm, Overall Length: 8.1/2/215mm, Air Inlet (Pt/Npt): 1/4, Air Hose (ID): 1/4, Net Weight: 1.10Kgs / 2.40Lbs",INR 34000.00,25% off,140,Drebon,,"Air Screwdriver, Push To Start, Auto Shut Off, 1/4 inch",A 1/4 inch push to start auto shut off air screwdriver.,
1/4 Push To Start Auto Shut Off Air Screwdriver,DB-SD-T55PB,Screwdriver,,"Hex Shank Size: 1/4, Screwing Capacity: M2.90-6.40mm, Free Speed (RPM): 1,000, Torque Range: 7-65Kgs/Cm, Overall Length: 8.1/2/215mm, Air Inlet (Pt/Npt): 1/4, Air Hose (ID): 1/4, Net Weight: 0.77Kgs / 1.70Lbs",INR 12075.00,25% off,140,Drebon,,"Air Screwdriver, Auto Shut Off, Push To Start, Screwdriver",An air screwdriver with auto shut off and push to start functionality.,
1/4 Composite Industrial Pistol Type Cushion Type External Air Screwdriver,DB-SD-R58BPN,Screwdriver,db-i-32.jpg (https://v5.airtableusercontent.com/v3/u/45/45/1759356000000/K7A7ocqef1KXNZJETn7y0g/ByG7A5hD9Z05CYud21nS1r8PxIGKHgTrNU1fpKOBstU03d4BThCd_-ovjGf3bhsrnj8LbEg4Iop8opmeY0hY5CxdgE3HjFNp-8ZtCsz1xyll3NtwfBxHcaohOxxhSybYC5RsH-ustYf-5cqgmKSPa3hRiRr0N9nszp4yMiKLA0Y/FkD8FJRgr7T0HrwxwKa6B8X2DcQYLQaf54iVVCySITI),"Hex Shank Size: 1/4, Screwing Capacity: 7mm, Free Speed (RPM): 750, Torque Range: 9Nm, Overall Length: 165mm, Air Inlet (Pt/Npt): 1/4, Air Hose (ID): 1/4, Avg. Air Consumption: 0.55Cfm / 3L/min, Net Weight: 0.87Kgs / 1.92Lbs",INR 15955.00,25% off,140,Drebon,,"Composite Industrial, Pistol Type, Cushion Type, External Air, Screwdriver",An industrial pistol type screwdriver with external air supply and cushion type design for screwing applications.,https://res.cloudinary.com/dkse0bpnm/image/upload/v1759342248/rwc29owikjhpc87fhlqn.png
1/4 Push To Start Auto Shut Off Air Screwdriver,DB-SD-QZUFD,Screwdriver,db-i-32.jpg (https://v5.airtableusercontent.com/v3/u/45/45/1759356000000/m6gGBoy64uYlpOISIBlRfg/mK5ICacQDnNwK3r2PdHmYISrq8HtHbMyjx98tdIsaANVhNNXpoZKNvr8JL-HvTBSoapli1VH24JzcVjeMZhWSYWBcp_XdIgYLWRfhbgN6tfwAijXL1-HDXKNeNQR2PaTiyegeICEvAjxsJb_TO2K9o8u3xa_sXUOW09cQ1GawsE/QuRCGokbhkIYCe7N13jmY0yyDvTLST3lNaWoLzILXu0),"Hex Shank Size: 1/4, Free Speed (RPM): 1,000, Torque Range: 1-8Kgs/Cm, Screwing Capacity: Mechanical M1.7-M3.3, Self Tapping M1.3-M2.7, Overall Length: 7/180mm, Diameter: 34mm, Air Pressure: 6 kg/cm2, Air Consumption: 0.2m3/Min, Air Inlet (Pt/Npt): 1/4, Air Hose (ID): 1/4, Net Weight: 0.54Kgs",INR 9950.00,25% off,140,Drebon,,"Air Screwdriver, Auto Shut Off, Push To Start, New Product",1/4 Push To Start Auto Shut Off Air Screwdriver for various screwing applications.,https://res.cloudinary.com/dkse0bpnm/image/upload/v1759342248/kx13tiehkxcpeici5a1k.png
1/4 Push To Start Auto Shut Off Air Screwdriver,DB-SD-Q30PB,Screwdriver,db-i-32.jpg (https://v5.airtableusercontent.com/v3/u/45/45/1759356000000/IRCTgdqKr8JFYjtHtS5TyA/YJd7bro_8f8oqP5Xl69iGj8634JPqmvckZQWiN1duoyPu8LU0MJLf_rcAd9Nxh7X75PMCfPyP3vtlrOk0uDCFvsZVTdWUr90QEIjO6M44ZMAofXlXQ3LDzl7jQMiF-wLNaL9iPXpet5PoEjFc1KQf3zqquKiw01dIDBwH8HruSY/BXMQwU9fGvAbdPNgNISIbiQcNa_fHOkt4w4ejyxF5pg),"Hex Shank Size: 1/4, Free Speed (RPM): 1,800, Torque Range: 1-8Kgs/Cm, Screwing Capacity: Mechanical M2.2-M4.2 Self Tapping M1.7-M3.2, Overall Length: 7/180mm, Diameter: 34mm, Air Pressure: 6 kg/cm2, Air Consumption: 0.2m3/Min, Air Inlet (Pt/Npt): 1/4, Air Hose (ID): 1/4, Net Weight: 0.54Kgs",INR 9950.00,25% off,140,Drebon,,"Air Screwdriver, Push To Start, Auto Shut Off, Pneumatic Screwdriver",An air-powered screwdriver with auto shut-off for precise fastening.,https://res.cloudinary.com/dkse0bpnm/image/upload/v1759342250/myf7ws5c3yvks3rvzmix.png
1/4 Push To Start Auto Shut Off Air Screwdriver,DB-SD-Q35PB,Screwdriver,db-i-32.jpg (https://v5.airtableusercontent.com/v3/u/45/45/1759356000000/jaNro_Xk_JRjL63jUHsfCQ/cQL9bJYwbfZS-l3cToi2IcIG6jNCzilP1Uh9pZA9CxtdOSUsnaD--IZIMT79LR7YHOMgC4fPl0UMUCXxrDriWJmPBlhkJd790o1z5v4MEafg2vLFriYMMFPWmEo7ICQ1iVeq7LDdRq3AFvCYy6o5ygg2kR0IppqzonL_tZA-zVY/j8pV1sG7ZuDSmn6-piP6zkNgNMUWXIB-q5jH0SePz6k),"Hex Shank Size: 1/4, Free Speed (RPM): 2,200, Torque Range: 3-20Kgs/Cm, Screwing Capacity: Mechanical M2.2-M4.5, Self Tapping M1.7-M3.5, Overall Length: 7/180mm, Diameter: 34mm, Air Pressure: 6 kg/cm2, Air Consumption: 0.2m3/Min, Air Inlet (Pt/Npt): 1/4, Air Hose (ID): 1/4, Net Weight: 0.54Kgs",INR 9950.00,25% off,150,Drebon,,"Air Screwdriver, Push To Start, Auto Shut Off, Pneumatic, DB-SD-Q35PB","An air-powered screwdriver with push-to-start and auto shut-off features, suitable for various screwing tasks.",https://res.cloudinary.com/dkse0bpnm/image/upload/v1759342251/yw6exwrsmvbrf4t0ovpk.png
1/4 Push To Start Auto Shut Off Air Screwdriver,DB-SD-Q38PB,Screwdriver,db-i-32.jpg (https://v5.airtableusercontent.com/v3/u/45/45/1759356000000/PefqXMftTJDvtHuHzYkTZQ/VHkkqmOFWfsayqjDytDXLp3QUPenon7vr2bsa6Af2OVwHN5Nu-4b0yd9EzSCJdNyzx-xB_gMFwbqX3AN13F9eAccYR9IDWvID2dUiJiEkAr3YDLfUJsfn3nDXHnZ2vhPojscjR3CWrQjjR5sOsiGn9ThZagUxLpFPeqvMzu3u3A/J9N3G81YcZHtE2LWFZeQ-Ss6FaZDefw8Epj2xgiuNZg),"Hex Shank Size: 1/4, Free Speed (RPM): 1,800, Torque Range: 3-25Kgs/Cm, Screwing Capacity: Mechanical M2.2 - M4.7, Self Tapping M1.7 - M3.8, Overall Length: 7/180mm, Diameter: 34mm, Air Pressure: 6 kg/cm2, Air Consumption: 0.2m3/Min, Air Inlet (Pt/Npt): 1/4, Air Hose (ID): 1/4, Net Weight: 0.54Kgs",INR 9950.00,25% off,150,Drebon,,"Air Screwdriver, Push To Start, Auto Shut Off, Screwdriver",This is a 1/4 inch push to start auto shut off air screwdriver.,https://res.cloudinary.com/dkse0bpnm/image/upload/v1759342253/hmm15xgbtzsvp64g9jwa.png
1/4 Push To Start Auto Shut Off Air Screwdriver,DB-SD-Q40PB,Screwdriver,,"Hex Shank Size: 1/4, Free Speed (RPM): 1,000, Torque Range: 5-30 Kgs/Cm, Screwing Capacity: Mechanical M2.8 - M5.0, Self Tapping M2.2 - M4.0, Overall Length: 7/180mm, Diameter: 34mm, Air Pressure: 6 kg/cm2, Air Consumption: 0.28m3/Min, Air Inlet (Pt/Npt): 1/4, Air Hose (ID): 1/4, Net Weight: 0.54Kgs",INR 9950.00,25% off,150,Drebon,,"Air Screwdriver, Push To Start, Auto Shut Off, Torque Control, Pneumatic Screwdriver",A 1/4 inch air screwdriver with push to start and auto shut off features for precision screwing tasks.,
1/4 Push To Start Auto Shut Off Air Screwdriver,DB-SD-Q45PB,Screwdriver,,"Hex Shank Size: 1/4, Free Speed (RPM): 800, Torque Range: 8-40 Kgs/Cm, Screwing Capacity: Mechanical M3.3 - M5.7, Self Tapping M2.7 - M4.4, Overall Length: 7/180mm, Diameter: 34mm, Air Pressure: 6 kg/cm2, Air Consumption: 0.3m3/Min, Air Inlet (Pt/Npt): 1/4, Air Hose (ID): 1/4, Net Weight: 0.54Kgs",INR 9950.00,25% off,150,Drebon,,"air screwdriver, auto shut off, push to start, industrial screwdriver, pneumatic screwdriver",A 1/4 inch push to start air screwdriver with auto shut-off functionality.,
1/4 Push To Start Auto Shut Off Air Screwdriver,DB-SD-Q48PB,Screwdriver,,"Hex Shank Size: 1/4, Free Speed (RPM): 1,700, Torque Range: 5-45 Kgs/Cm, Screwing Capacity: Mechanical M2.8-M5.8, Self Tapping M2.2-M4.7, Overall Length: 8/215mm, Diameter: 42mm, Air Pressure: 6 kg/cm2, Air Consumption: 0.55m3/Min, Air Inlet (Pt/Npt): 1/4, Air Hose (ID): 1/4, Net Weight: 0.90Kgs",INR 11800.00,25% off,150,Drebon,,"Air Screwdriver, Push To Start, Auto Shut Off, Pneumatic Screwdriver",A 1/4 inch air screwdriver with push to start and auto shut off functionality.,
1/4 Push To Start Auto Shut Off Air Screwdriver,DB-SD-Q50PB,Screwdriver,,"Hex Shank Size: 1/4, Free Speed (RPM): 1,400, Torque Range: 7-50 Kgs/Cm - 0.70-5.00Nm, Screwing Capacity: Mechanical M2.9-M6.0, Self Tapping M2.6-M4.9, Overall Length: 8/215mm, Diameter: 42mm, Air Pressure: 6 kg/cm2, Air Consumption: 0.55m3/Min, Air Inlet (Pt/Npt): 1/4, Air Hose (ID): 1/4, Net Weight: 0.90Kgs",INR 11800.00,25% off,150,Drebon,,"Air Screwdriver, Auto Shut Off, Push Start, 1/4 inch, Torque control",A 1/4 push to start auto shut off air screwdriver for various screwing capacities.,
1/4 Push To Start Auto Shut Off Air Screwdriver,DB-SD-Q55PB,Screwdriver,,"Hex Shank Size: 1/4, Free Speed (RPM): 1,000, Torque Range: 7-65 Kgs/Cm, Screwing Capacity (Mechanical): M2.9-M6.4, Screwing Capacity (Self Tapping): M2.6-M5.4, Overall Length: 8.1/4/215mm, Diameter: 42mm, Air Pressure: 6 kg/cm2, Air Consumption: 0.28m3/Min, Air Inlet (Pt/Npt): 1/4, Air Hose (ID): 1/4, Net Weight: 0.90Kgs",INR 11800.00,25% off,150,Drebon,,"Air Screwdriver, Auto Shut Off, Push To Start, 1/4 inch, Torque Range, High Speed",This 1/4 inch push-to-start air screwdriver features auto shut-off and is suitable for various mechanical and self-tapping screw applications.,
1/4 Push To Start Auto Shut Off Air Screwdriver,DB-SD-Q60PB,Screwdriver,,"Hex Shank Size: 1/4, Free Speed (RPM): 550, Torque Range: 15-95 Kgs/Cm, Screwing Capacity: Mechanical M4.1-M7.0, Self Tapping M3.1-M6.0, Overall Length: 8.1/4/215mm, Diameter: 42mm, Air Pressure: 6 kg/cm2, Air Consumption: 0.28m3/Min, Air Inlet (Pt/Npt): 1/4, Air Hose (ID): 1/4, Net Weight: 0.90Kgs",INR 11800.00,25% off,150,Drebon,,"Air Screwdriver, Push To Start, Auto Shut Off, 1/4 inch, Torque, Mechanical Screwing, Self Tapping",A 1/4 inch air screwdriver with push to start and auto shut off features for various screwing capacities.,
1/4 Push To Start Auto Shut Off Air Screwdriver,DB-SD-Q65PB,Screwdriver,db-i-32.jpg (https://v5.airtableusercontent.com/v3/u/45/45/1759356000000/vuo6NC4OpcvimBaxgPKlXA/xcD-DzDMlkiOA5Olqq5eH1kICvqoIy9s6v8xnmqZUgTHdoqERSnHWzQAYR0u6R5yoeyK7eBSlzyS-4rt_ded_V1u2eyW7DFy7FJXU2viJd3QI9NBSlVHkHIGCR4fv4xi89B4Oz2Qf-tOq2k0cYQk9vyFIq6nfkgl3x--0eMRcIQ/S2F2Fj9xKI3K_0C09LKVsgnAeljTj9_FwhslOJYDvIc),"Hex Shank Size: 1/4, Free Speed (RPM): 300, Torque Range: 30-180 Kgs/Cm, Screwing Capacity: Mechanical M5.0-M9.3, Self Tapping M4.0-M7.2, Overall Length: 8.1/4/215mm, Diameter: 42mm, Air Pressure: 6 kg/cm2, Air Consumption: 0.28m3/Min, Air Inlet (Pt/Npt): 1/4, Air Hose (ID): 1/4, Net Weight: 1.00Kgs",INR 13600.00,25% off,160,Drebon,,"Air Screwdriver, Push To Start, Auto Shut Off",This is a 1/4 Push To Start Auto Shut Off Air Screwdriver.,https://res.cloudinary.com/dkse0bpnm/image/upload/v1759342254/ka7vdhab4earsvmebfbc.png
1/4 Push To Start Auto Shut Off Air Screwdriver,DB-SD-Q68PB,Screwdriver,db-i-32.jpg (https://v5.airtableusercontent.com/v3/u/45/45/1759356000000/-HEipCaN3EkEoSWo48orUQ/qt0wsw-LKClqzGojzIiW7RcuoNovUR-nIfRBK40cw8H53FusEY81dTVI8r40Ee8Vl3StPE4CT3TEb6L5RQeGpB3LOmGigt8ZsWm-jLAdwSqA62JskNg-ibeMl-eBQUr3FdneUd_mhogk-HwhZlXVp36c7sa_wtGY9bEvo_E7qCQ/Vq5t6yeOOigPY6g7aXuhYVOpw4rX7qPT30eeMTHY4mE),"Hex Shank Size: 1/4, Free Speed (RPM): 250, Torque Range: 50-280 Kgs/Cm, Screwing Capacity Mechanical: M6.0-M11.0, Screwing Capacity Self Tapping: M4.9-M8.7, Overall Length: 8.1/4/215mm, Diameter: 42mm, Air Pressure: 6 kg/cm2, Air Consumption: 0.28m3/Min, Air Inlet (Pt/Npt): 1/4, Air Hose (ID): 1/4, Net Weight: 1.00Kgs",INR 15500.00,25% off,160,Drebon,,"Air Screwdriver, Auto Shut Off, Push To Start, Pneumatic Screwdriver",This air screwdriver is designed for precise and controlled fastening operations with an auto shut-off feature.,https://res.cloudinary.com/dkse0bpnm/image/upload/v1759342254/zx6euno7taj696vtym5h.png
1/4 Lever Start Auto Shut Off Air Screwdriver,DB-SD-Q30LB,Screwdriver,db-i-32.jpg (https://v5.airtableusercontent.com/v3/u/45/45/1759356000000/E53oPT8Q4AmfYQxFyKB9Dw/F_j0snfTRuWnaKDhmcPjZ2wJhxsEjigd7RJFpCvZN5MPWBqRxzmmk6VEnwEznLEVRC6ZWH8dTt_1y3HxIltRoxgujvgyz64HzaHIPBOc0mGVzDSYQjgiEa6v8q4gw0VnqoivDpFQ8ts0uJ3PxKzeGY_q3nz9qSlPmOz7QE5UojQ/dnlkwLufNfQoRTbi38O7hfnlgkjY_cegHMdKrUP5GhQ),"Hex Shank Size: 1/4, Free Speed (RPM): 1,800, Torque Range: 3-17Kgs/Cm, Screwing Capacity: Mechanical M2.2 - M4.2; Self Tapping M1.7 - M3.2, Overall Length: 7/180mm, Diameter: 34mm, Air Pressure: 6 kg/cm2, Air Consumption: 0.28m3/Min, Air Inlet (Pt/Npt): 1/4, Air Hose (ID): 1/4, Net Weight: 0.54Kgs",INR 10500.00,25% off,160,Drebon,,"Air Screwdriver, Lever Start, Auto Shut Off, Pneumatic Screwdriver",This air screwdriver features a lever start and auto shut-off for precise and efficient screw driving operations.,https://res.cloudinary.com/dkse0bpnm/image/upload/v1759342255/cnfwyvlpye59zalje4a2.png
1/4 Air Die Grinder Composite Body (Front Exhaust),DB-DG-35F,Grinder,db-i-32.jpg (https://v5.airtableusercontent.com/v3/u/45/45/1759356000000/z9bStGhFCYLF3obniwHdDg/1LmTErP9jxeVLKv6jsqlofRt-1FyLmaLJzeaZjN3VF9tt_gT-we22OqBY0K-cw2lFuT_na8yVH8veW47bBPWnXHhmyPd5bQKtIppTjUDLNb6gtc5V4oN6FoOJMXSeGpjkSxqQsuHb9OrKcHOOToIavq0NcLkjnqXsXghj_YFb7U/Ho7_a3xUa7EYOZLso-Rpb13Gn9rtxh_IPipVGN6pM-Q),"Collet Size:1/4 / 6mm, Free Speed (RPM):22,000, Overall Length:, Air Inlet (Pt/Npt):1/4, Air Hose (ID):3/8, Avg. Air Consumption:4Cfm / 113L/min, Net Weight:0.50Kgs / 1.10Lbs",INR 1580.00,25% off,160,Drebon,,"Air Die Grinder, Composite Body, Front Exhaust, Grinder","This air die grinder is designed for precision grinding, polishing, and deburring applications.",https://res.cloudinary.com/dkse0bpnm/image/upload/v1759342257/s3n0e5iwicsn3wwm2v6i.png
1/4 Air Die Grinder,DB-DG-33,Grinder,db-i-32.jpg (https://v5.airtableusercontent.com/v3/u/45/45/1759356000000/yZdV6mnWQ0L3TjPC7YGqQg/MMrWzAWRqsfDLdjYxrIqTftQ6Uhn8tk33BHm7nsHovw1hIBgS0LlKBcTGKMqaUxDSskUBGjGrO0g-pu424b5qSQ9zarAp863eIp2b4R5hgiSR8JD3FWP8KvFbctBWWZI5hXSqWhwN5dVwaD3BByLqQAlxMKz2-8llAhBDLDZx0c/uSuW5CNYraHEYn1G-bcMyCiR4ObP-KxF3HzVPgjtgt4),"Collet Size: 1/4 / 6mm, Free Speed (RPM): 22000, Overall Length: 6.3/10 / 160mm, Air Inlet (Pt/Npt): 1/4, Air Hose (ID): 3/8, Avg. Air Consumption: 4Cfm / 113L/min, Net Weight: 0.70Kgs / 1.54Lbs",INR 1995.00,25% off,160,Drebon,,"Air Die Grinder, Grinder, DB-DG-33",This is an air-powered die grinder designed for various grinding and finishing tasks.,https://res.cloudinary.com/dkse0bpnm/image/upload/v1759342258/dlcvtzhluzgrlw7nj8td.png
1/4 Industrial Die Grinder,DB-DG-7200,Grinder,db-i-32.jpg (https://v5.airtableusercontent.com/v3/u/45/45/1759356000000/fX19H5P82th-q8YYUPj1xA/4HvMOuxISGAo0hSTPBLIsobXGVXTKXEuhrblIbQmmpZmiyL0lj1p2f7um0K6126kMFABrI_9FrRQKm9O9ET6ULX9TEbix9oK_6LquQ3cgM3BTLxg-CqsY0O5DkAak5KTdEJ9O0gFyuOuv3--_drIqTWLEC0U1EqZDHbdhArtNm8/Uny1uiQbZaBPrhxF_qsgbwjaUrGkzVZIvX34RGFKDV0),"Collet Size: 1/4 / 6mm, Free Speed (RPM): 25,000, Overall Length: 6 /153mm, Air Inlet (Pt/Npt): 1/4 , Air Hose (ID): 3/8, Avg. Air Consumption: 3.5Cfm/99L/min, Net Weight: 0.36Kgs / 0.80Lbs",INR 2810.00,25% off,160,Drebon,,"Industrial Die Grinder, Die Grinder, Grinder, Air Grinder, Pneumatic Grinder",An industrial die grinder suitable for various grinding applications.,https://res.cloudinary.com/dkse0bpnm/image/upload/v1759342259/koxn9ogesgcfqyghgu2p.png
0.3HP 1/4 Mini Air Die Grinder,DB-DG-30,Grinder,db-i-32.jpg (https://v5.airtableusercontent.com/v3/u/45/45/1759356000000/xCZcbChhNe3iVc6HHxdpDQ/T2_-uqpC-QMjz_x7-H4-3XbXkmVhun-eSWldD_byZQAtwuhMkirKiQY_CfkC6rj7gz4dX9rSsfLdkPGFnAaHJa_G5UXEp-xm_Rj4QYbCizqv_r6gNy7EI6ttG49Q84fOWsqrFaT9Y39B4fH117u0haApovwoiN0U7sDrHRt-ZgU/HqAA5m0QyZ_UMtPZZsu5iY8u7CsImd1BgyV2T3VNXQQ),"Collet Size: 1/4 / 6mm, Free Speed (RPM): 25,000, Overall Length: 6.1/4/160mm, Air Inlet (Pt/Npt): 1/4, Air Hose (ID): 1/4, Avg. Air Consumption: 6Cfm/170L/min",INR 4195.00,25% off,160,Drebon,,"Mini Air Die Grinder, Air Grinder, Die Grinder, Grinder","Used for grinding, polishing, and deburring in various applications.",https://res.cloudinary.com/dkse0bpnm/image/upload/v1759342260/nu7nvkrm8fbsspm5mpwe.png
1/4 Air Die Grinder Roll Type,DB-DG-17,Grinder,db-i-32.jpg (https://v5.airtableusercontent.com/v3/u/45/45/1759356000000/JVUyx4ny1eHhYh-h3-Nrqg/0qFaO7Ga5TrQqggldv7qJ2N6DQVlIJrI4-O17yuVvfEsQ4R-tiPBnTF3CwTnv0hcdpsJCMQ25pzGw763hgDio4HAuEEixXVM5yCB4x7Ukul7AB4a6kyEF8BPbIa6aUcH-IHJrMM5Zt6vxn6OVhyC5hNCBMKZYVn30xgr-g6xtzQ/AClR5QeB-y2bAZksFyNgZMxciNGbN7slBF8600k1Wto),"Collet Size: 1/4 / 6mm, Free Speed (RPM): 22,000, Air Inlet (Pt/Npt): 1/4, Air Hose (ID): 3/8, Avg. Air Consumption: 4Cfm / 113L/min, Net Weight: 0.50Kgs / 1.10Lbs",INR 6660.00,25% off,160,Drebon,,"Air die grinder, roll type, pneumatic grinder, DB-DG-17",This 1/4 inch air die grinder roll type is used for various grinding applications.,https://res.cloudinary.com/dkse0bpnm/image/upload/v1759342261/njpj6vdtntahaohlpll0.png
0.4HP 1/4 Air Die Grinder,DB-DG-54,Grinder,db-i-32.jpg (https://v5.airtableusercontent.com/v3/u/45/45/1759356000000/JYLs-DGLXyTSfsTZgQq9Tg/5QbLfOG3GdkkUdmazXEPvE1-vrTqgwegvCNYvkSdFzsAjoIArwT9_K2BPRahdnVmy2gsOJ7hVHICyEoGjZ7bnWbgCvUKNQrWalMZeXGC22bakqMy2XNxoaYEg0rsQsfHDXAU5N8Oo6d-_C3oulXgyJqUK0EHRgSM8y_R3Pp12Is/s0TnG07o_u3bu9Tu2dyngPq-mSZCGpe59X7PlkZTfHQ),"Collet Size: 1/4 / 6mm, Free Speed (RPM): 22,000, Overall Length: 6.1/4/175mm, Air Inlet (Pt/Npt): 1/4, Air Hose (ID): 1/4, Avg. Air Consumption: 6Cfm/170L/min",INR 5800.00,25% off,160,Drebon,,"Air Die Grinder, Grinder, Pneumatic Grinder, Die Grinder","Used for grinding, polishing, and deburring various materials with compressed air.",https://res.cloudinary.com/dkse0bpnm/image/upload/v1759342262/m0wpgjjh8ol4yv4ja0to.png
Air Angle Die Grinder (Front Exhaust),DB-DG-305G,Grinder,db-i-32.jpg (https://v5.airtableusercontent.com/v3/u/45/45/1759356000000/gJfS7gepvLtr6Xt-O7DXBg/FRpMFzpeC8SlY6wvpCztMjmW8S_Tjd3Nc6_oJE8NQvJg391qnipGsxCpnY4SLvep_ly1BfxTNFMfAB0tchk2jmrN_ANFbu9S07biPcFKSV9dQRox9h0sx8i7QCp2hyfy2hdeaYTD3BFqybRpZatDjYqS85y13AYu0cz0tbAoi9c/zhDNGx5IR4SfhkF32GeVYWtUpjLUqHEnZ5yvj0c4qE0),"Collet Size: 1/4 / 6mm, Free Speed (RPM): 20,000, Overall Length: 6.5/16/160mm, Air Inlet (Pt/Npt): 1/4, Air Hose (ID): 1/4, Avg. Air Consumption: 4Cfm/113L/min",INR 4920.00,25% off,170,Drebon,,"Air Angle Die Grinder, Front Exhaust",This air angle die grinder is designed for various grinding applications.,https://res.cloudinary.com/dkse0bpnm/image/upload/v1759342263/brfrcoqjosamntogtp8j.png
Air Mini Die Grinder,DB-DG-205,Grinder,db-i-32.jpg (https://v5.airtableusercontent.com/v3/u/45/45/1759356000000/e6ibehVfh7sjBVw9Ei7CSg/08Jx2EhBICzvG0YUNOdERTDgMdnGJqp6u5wUIC1_YhtvtZA_py6kT1lm0MLtv-tliLXwIufP_NzLJG56Ce9V-MDBNSgE998dHQtyTWbLhsf-6h6QkNeiDqtHQV-6tXAzyl1O0wohWMJfd41UUM0WGVRYVLavPY_laT6vsxe7qyw/nu9so6i5rvO_Gsq3_z-VrVUBfHHluPVbWpiCSsNmXJ8),"Collet Size: 1/4 / 6mm, Free Speed (RPM): 25,000, Overall Length: 4.3/4/120mm, Air Inlet (Pt/Npt): 1/4, Air Hose (ID): 1/4, Avg. Air Consumption: , Net Weight: 0.65Kgs / 1.44Lbs",INR 2740.00,25% off,170,Drebon,,"Air Mini Die Grinder, Grinder, Die Grinder, Pneumatic Grinder, Mini Grinder, Air Tool","A compact pneumatic tool used for precision grinding, polishing, and deburring tasks.",https://res.cloudinary.com/dkse0bpnm/image/upload/v1759342264/dtggfnbuzksqopfdkvgw.png
Air INDUSTRIAL Angle Die Grinder Roll Type,DB-DG-20ADG,Grinder,db-i-32.jpg (https://v5.airtableusercontent.com/v3/u/45/45/1759356000000/niy9QT8Y6JgPC5vorTJXRg/BkFY6DoqZ4H4jxv7U64D3BNT_B9paiIo7-kgK-KcPblMXXhVh6X9uLLvJLJPXEfEmF-O2WqKrGrdz0MNER_Q70orLmw14A2caG1e-NkbNSOnMtrxn6VEmMdnR0sf_zzIN41EIHea07v7qC7OmY6xErfaQGUhv6-HM2GRctorxmA/YR1nHQ03Tz7la3JaFbm9pKQGkhYSJxD37vHvDTBlexg),"Collet Size: 1/4 / 6mm, Free Speed (RPM): 15,000, Overall Length: 6.5/16/160mm, Air Inlet (Pt/Npt): 1/4, Air Hose (ID): 1/4, Avg. Air Consumption: 4Cfm/113L/min",INR 15060.00,25% off,170,Drebon,,"Air Grinder, Industrial Grinder, Angle Die Grinder, Roll Type Grinder",An industrial air-powered angle die grinder for various grinding applications.,https://res.cloudinary.com/dkse0bpnm/image/upload/v1759342265/kxseuw6uo9b0c6wgf6fb.png
Air Angle Die Grinder (Front Exhaust) 1.3HP,DB-DG-36M,Grinder,db-i-32.jpg (https://v5.airtableusercontent.com/v3/u/45/45/1759356000000/xmQ8i0qN1K4lm30oFDqfUw/x19ieKHbP-x40yUkrcL-jEI6tx01g8sAjCX5bGuWCJo7bQO3ga9Pv4ISXQsKoFnB2ktWvEcpc8Di0HJlskE53Jvv5X9rfODVZ4gkyDYn69yMvD8xQhSeArZVp6Io1fuCH0b0wvDPA8wDrKImpspMWr_4C_6bVsc3L-UA2aVl550/Sx_LW32duPfy6ko2jD_n_8lebzGeSyRb9Fo7QykZ_w4),"Collet Size: 1/4 / 6mm, Free Speed (RPM): 20,000, Overall Length: 6.5/16/160mm, Air Inlet (Pt/Npt): 1/4, Air Hose (ID): 1/4, Avg. Air Consumption: 4Cfm/113L/min",INR 7815.00,25% off,170,Drebon,,"Air Angle Die Grinder, Front Exhaust, 1.3HP, Grinder, Die Grinder, Angle Grinder",An air-powered angle die grinder with front exhaust and 1.3HP motor.,https://res.cloudinary.com/dkse0bpnm/image/upload/v1759342266/jegmwuqa0iokdvrdaqag.png
Air INDUSTRIAL Angle Die Grinder Roll Type,DB-DG-108L,Grinder,db-i-32.jpg (https://v5.airtableusercontent.com/v3/u/45/45/1759356000000/8tu7JHan8exLCNOphPSzRA/mTheiDhZHqQG-SI_HJ9g9jVinnTs43QwYRcx4O6XPiqQO1FQl0jJ1rUYWZZ6nrgxuVelowNpJYIFl7uMGcTnHrFEXaJNVzcrXqohGq2YsImpf30v7b3OzlRUDN7v9S6oRp3rks7u1I-3Q681HMxsmWDdP_e77a3hk7pjDGRX7Kw/o6opwctU19goU4wlbHyIG8JsrY_p6OOPBhRVQeDqKcI),"Collet Size: 6mm, Free Speed (RPM): 15000, Avg. Air Consumption: 0.59m³/min, Using pneumatic Press: 65kgf/m2",INR 5990.00,25% off,170,Drebon,,"Air Grinder, Industrial Grinder, Angle Die Grinder, Roll Type Grinder, Pneumatic Grinder",Operates with pneumatic press.,https://res.cloudinary.com/dkse0bpnm/image/upload/v1759342267/tdutamvyzjisnpw6wnck.png
0.4HP Industrial Roll Type Throttle Extended Air Die Grinder,DB-DG-3050 (IND),Grinder,db-i-32.jpg (https://v5.airtableusercontent.com/v3/u/45/45/1759356000000/Q9lyUGBGnM3k9ykvSyBWqw/bR-5iPPRVHZFOXg-e275NtOaONT3ayRPXbwg6MGhC9SyiBXDotYtfEZqH1cni8xx94qgrx5QLecnJqoWhy9xthqFkCSuHsvOJMPAcZF4ghGLBcGPWJN16gwF9QP0Y1OAisf4CjreLkdCreUCOSRW-fY6ZsirpthwJokZwrfzM2Y/XJyp7E1jvQyHfbTkomHwrq4sX9EXWXSk7nG9BayZdeE),"Collet Size: 1/4 / 6mm, Free Speed (RPM): 24,000, Overall Length: 8.7/10 / 264.40mm, Air Inlet (Pt/Npt): 1/4, Air Hose (ID): 3/8, Net Weight: 0.73Kgs / 3.40Lbs",INR 14045.00,25% off,170,Drebon,,"Industrial, Roll Type, Throttle, Extended, Air, Die Grinder","Used for grinding, polishing, and deburring in industrial applications.",https://res.cloudinary.com/dkse0bpnm/image/upload/v1759342268/geottwbwqihblgudaegu.png
Air Die Grinder (Long Body) Roll Type,DB-DG-3050,Grinder,db-i-32.jpg (https://v5.airtableusercontent.com/v3/u/45/45/1759356000000/E0hi7A8lb1qtSzbt2nspbA/jsDRL7Nfdi-effEbyug7s2bnOsgoDDwmeJaYE-9kdqr-UiHZ6AwrF3XHYJspY3S19GLX5eG-pT3SKFyNTiDrcz1WFeQ5LCHFaZjcbdssDXmChVU5fzkmG3PZkgr8CCLYPAsPJ8Epg4QYquYQgZTncJnxp1GJA61_gVI8XxqWdDo/xzngqyz1kjUWgR8zY_K5kgyOq1NJ3kMHlrSit9QqBHo),"Collet Size: 1/4 / 6mm, Free Speed (RPM): 15,000, Overall Length: 13.1/2 / 345mm, Air Inlet (Pt/Npt): 1/4, Air Hose (ID): 1/4, Net Weight: 1.55Kgs / 3.40Lbs",INR 11110.00,25% off,170,Drebon,,"Air Die Grinder, Long Body, Roll Type, Grinder, Pneumatic Grinder","This air die grinder is used for precision grinding, polishing, and deburring applications.",https://res.cloudinary.com/dkse0bpnm/image/upload/v1759342269/do4vpgaw6xlxf3ifbn8q.png
