Product Name,Model,Category,Image(s),Specs,Price (INR),Discount Info,Slide No,Brand,Stock Status,Keywords,Usage Description,cloudinary_url
Air Angle Screwdriver,4467,Screwdriver,64BCEE92-6656-46A2-8878-6322654455F4.jpeg (https://v5.airtableusercontent.com/v3/u/45/45/1759356000000/xGlZsShvk82wHrYJfLCASQ/4DRPt4-IQGefFymIFcHfRDNXxQjL6whYZO-UZjmOiMuPuJGmEXZuzs5Qt73F9v_ZDqW0L_8S4gFXp6oMHLQXKckoJEzVKdvSU2ChdCq57CVnxI-QTVk-6cXzGnDaCfNRpA0nBrR3WSSjhwKvJpXvcGteAze9MXCv03ZJF5rTkNgq3LC_LxsN-qgYncJB2_Xt/xSxqs0PmV1XdWbigwXm5pfgvgX8_J8_FKAVoel4kYTw),"Max Torque: 6 Nm, Capacity Bolt Size: 4–5 mm, Free Speed: 12000 RPM, Length: 220 mm, Net Weight: 1.1 kg",INR 16000.00,Up to 50%,2,Spark Pneumatics,,"Angle screwdriver, 6Nm torque, 12000RPM","Used in electronics assembly, control panels, and light industrial fastening where compact torque tools are required.",https://res.cloudinary.com/dkse0bpnm/image/upload/v1759342131/qv3kf6vtiluqabw60pmg.jpg
Air Screwdriver,TMC-56SP,Screwdriver,A9A5C908-CD37-4E5F-BD6A-20F772DB4B0C.jpeg (https://v5.airtableusercontent.com/v3/u/45/45/1759356000000/h8KaWnDBYSGpNsbtNBjR1A/IUlG8Pure7KzWygfaGyMO3y0OMTXhCVhDQf5Wv1NmpBEYttm81-nDmmDFYSb46hTSzxNLXG6CWpWWYr8eUjbyIWEv-Y9l2cadIXcZjkwUoV78tThU0ajIPfKZhvRWFmwdxl2MBwrfWZliC7_zcsEOjjpzQxIUym5gJz7k9B6dtbKhvGF6dY4EHSpYsf5KSTU/K4FSXCJXoW4gKaHmLdolBqebrZzibejHbLglq28vfPg),"Square Drive: 1/4, Capacity Bolt Size: 6–8 mm, Free Speed: 10000 RPM, Max Torque: 75 Nm, Length: 195 mm, Air Hose: 3/8, Inlet: 1/4, Consumption: 3.1 CFM, Weight: 0.9 kg",INR 3250.00,,3,Spark Pneumatics,,"Air screwdriver, torque 75Nm",Ideal for workshops and assembly lines to fasten medium-sized bolts quickly and reliably.,https://res.cloudinary.com/dkse0bpnm/image/upload/v1759342132/xnglsv6zyhd2yzxvmgdb.jpg
Air Impact Wrench,1505,Impact Wrench,22A30C08-2CBE-4CE9-9B8C-A2C9A42C9C96.jpeg (https://v5.airtableusercontent.com/v3/u/45/45/1759356000000/5i6rjxr2D1icMZkUhwFn9Q/eSz7q1ehzHZzlLJaTlMVzIar0oxoAKadxsmKFqUfQ_4fXYNUv8VWaizQYdDz2zD2lqBzCt3-_6e6x5EMn7yKKewZsOMeGYQPMPVzf-hhZ01F6f7yXISCSglzC6HVxBQQhaGUJLAf4bL5pxrvB7LwqsSHjf8aI1O4ASMnnoaL1UG2KkiwiXB6OA6cHOg6XrNr/hYTd3nHS4PLi9Oc6Vd8zMecWvVMQejUksA9PptgURfY),"Square Drive: 1/2, Capacity Bolt Size: 16 mm, Free Speed: 7500 RPM, Max Torque: 650 Nm, Length: 180 mm, Hose: 3/8, Inlet: 1/4 PT, Consumption: 4.2 CFM, Weight: 2.56 kg",INR 6150.00,,4,Spark Pneumatics,,"Twin hammer wrench, 650Nm torque",Widely used in automotive repair shops for tightening and loosening wheel nuts and medium-duty mechanical work.,https://res.cloudinary.com/dkse0bpnm/image/upload/v1759342133/iagbox5jpl6h0jgigaex.jpg
Air Pistol Type Screwdriver,56PH,Screwdriver,AFC8FF9C-0781-4E11-8CF3-073908E3E6B9.jpeg (https://v5.airtableusercontent.com/v3/u/45/45/1759356000000/K9cCpH3I0xrRNfUf-KuETQ/dHV72b_VkdFnKBq73DwcDmJAI6NqKBX_Y_-3eYjRD9gQU4A5Wi9DUixjR9vZkg9Vdj2UPF4Joap9T7izcycZogb0E0aIjVNt07I3PtppOWLLnL52OQE5XkIV9vUTlXMFbvhjkUB2nn42jUiTB3rnOiDeCyAmpWIAll7ahOTlWbbd4IY-EN7H2H-DImLG9vaP/F_3YpPiq5Y9iUt4bbyXeHEoSrygqJl2_dzDSguAoYF0),"Square Drive: 1/4, Capacity Bolt Size: 10 mm, Free Speed: 9000 RPM, Max Torque: 125 Nm, Length: 155 mm, Consumption: 4.2 CFM, Weight: 1.25 kg",INR 6000.00,Up to 50%,5,Spark Pneumatics,,"Pistol screwdriver, torque 125Nm",Handy in machinery assembly and maintenance tasks where pistol grip offers ease of use in tight spaces.,https://res.cloudinary.com/dkse0bpnm/image/upload/v1759342134/e0glbkhswwm5y0fku4pm.jpg
Air Sander (Non-Vacuum),P2013,Sander,Image 21-09-25 at 10.14 AM (3).jpg (https://v5.airtableusercontent.com/v3/u/45/45/1759356000000/0HYvaGaHp0ebqTrjoaz56Q/ooQMNED7auJyAlpZ5ic_0s3lSFjhYNHGhxtpUkTc0iOb6sJPbjFmArWbdvORdQurCzvIJ1quiUE_DdkQ4NKnATArRITNclCladQzXpNYSKSdDkfq1QdI1TXoMr8T-uAgouO2Ng7-U-_V-ruzKQy5IGyyr2zVgle_T_5OTnM8F2ZNCfuOORl8ZLaBjBS52Dye/tD96RGCmsogF7C3ZNLnaxhItHtL2qIAufwtm3HdKFMQ),"125 mm pad, Orbit: 5 mm, Free Speed: 12000 RPM, Weight: 0.87 kg",INR 6450.00,Up to 50%,6,Spark Pneumatics,,"Air sander, precision sanding","Used for finishing wood, paint, or metal surfaces, providing smooth sanding in carpentry and fabrication.",https://res.cloudinary.com/dkse0bpnm/image/upload/v1759342135/eim8mit2bgtmno2fm2wm.jpg
Air Sander (Vacuum Type),G2009,Sander,5808B990-EECE-4E22-94E3-8F47AD5320A0.jpeg (https://v5.airtableusercontent.com/v3/u/45/45/1759356000000/z5I9h6mq10qkJXAQSrutmA/VoGF6ZBm4svC393XfQnxbNVxOppmlidGZhJ9ZNq2IkQEu9CZk29dmNSsWovI1yrCp0AqFfLbxGSM1Xogz1VVsxtkG3cmRPDYNpB6-xbtDqTAMK7Mxqr7bIhAsSnbJr-MJJq8MTlu1F92hEB71FZlwn8w8tm5_aqF9sxZbhemTSIu2PyMyeLGSVJz8xjQlcS3/ideE76iolWEsm84R9DNQKGQ3p0yhWgQ8MzX84h9-Xs0),"125 mm pad, Orbit: 5 mm, Free Speed: 9000 RPM, Weight: 0.87 kg",INR 2800.00,Up to 50%,7,Spark Pneumatics,,"Vacuum sander, smooth finishing",Preferred in woodworking and car refinishing where dust collection and clean sanding are required.,https://res.cloudinary.com/dkse0bpnm/image/upload/v1759342136/ww8vtwpcy9wt8qonbv32.jpg
Air Riveter with Kit,6615K,Riveter,4F800030-918A-4841-8DD9-23AB3DA5A593.jpeg (https://v5.airtableusercontent.com/v3/u/45/45/1759356000000/GBYzMnaGTqAzBB6KsK28KA/OxjaRl2XibBHKiJ_CN7TbE64k3nako0T8gW_lpuPe6Ra4oUq988-87sSShKgVRtb_zi0GxrlSdkP84DXWbiSp6aZNvXk_zWRRlv_Smp-dvFe1_DKFJvoiLAQK7LGVxkDnNry_0lVifw9WDW6i9BzkSVj0Z_TeQckj_P7_68xXtfq-dT3Qqzo50esPDyHbojl/1rwEGdllBrYnJhdRH4ZCr2WzCn3yg11Gd1x5qhhaS1U),"Pneumatic riveter complete with accessories kit. Ideal for sheet metal, fabrication, assembly.",INR 6800.00,Up to 50%,8,Spark Pneumatics,,"Air riveter, sheet metal, assembly","Common in sheet metal fabrication, HVAC ductwork, and construction for quick and strong riveting.",https://res.cloudinary.com/dkse0bpnm/image/upload/v1759342137/hgivoyk9fyutfe3rtofm.jpg
Air Brad Nailer T50,T50,Nailer,DF9E9F21-529D-463D-9DDD-182ACB95ED60.jpeg (https://v5.airtableusercontent.com/v3/u/45/45/1759356000000/bOgxWyVEx7IERW69EUsvIQ/bNRue_Vz-irlWxnE6xq3fSLVotDY1NHylXgKbW7T-oqgEhr5729jLJSn5qjpr5-Ok_UaeaaYow9eZhKNrip6o7iKgRGD_1SHBuCODo6a91uC9tmswbHuPt2H6F74wkj5qufxJcMgwKEErM3A1OhKdHejKOztPAvBRUduzdechET4E_HDHNUGqR5uwjmnPWqF/dn6gxYU46KI2usu9kFJUjgu6yTdQfEwOVxhTlL8NK0A),"16-gauge brad nailer, side-loading system, durable alloy body, safety lock.",INR 7000.00,,9,Spark Pneumatics,,"Brad nailer, 16-gauge","Used in furniture making, carpentry, and construction where precise nail fastening is required.",https://res.cloudinary.com/dkse0bpnm/image/upload/v1759342138/psbgc7npmv2qsgm5cijg.jpg
Brad Nails (T series),T-series,Nails,5F9DB3B0-4FDB-4B2E-8275-8E168A4FBA28.jpeg (https://v5.airtableusercontent.com/v3/u/45/45/1759356000000/jgzP_m2kYkNYE0ONFM6yyg/0JI4eZcMmJ94dsZguldFWOciA8pln4Un4rInp5JcnQzEMAi6dWXKQuDm4jMYeCBHxBlidsF4nURCmWTVNvYsNEU09-xC3TCrszWNBSHrXaQmZf58ccxOT8bffot0C4-dUXHUWq76yYSNaDwDmMB0rFXCKNCwfUABRFf2dt22c5P678W4balOhy9dJxmc-7Ik/Tz9nqGL-y2cRLR7mgYQTa2XRkB3pit13ooNB7TC8mug),"16-gauge brad nails, 20–50 mm sizes available.",INR 0.00,"Less than 1 carton → No discount, Customer: ≥ 1 carton → 5% discount, Dealer: ≥ 1 carton → 10% discount",10,Spark Pneumatics,,"T-series brad nails, 16-gauge","Consumable brad nails for T-series nailers, used in furniture and woodworking fastening.",https://res.cloudinary.com/dkse0bpnm/image/upload/v1759342139/vbdtasa2ldoensty2cn9.jpg
Air Brad Nailer F50,18/50E,Nailer,BB94CA46-D927-47AC-9D65-3C9F842CE8B4.jpeg (https://v5.airtableusercontent.com/v3/u/45/45/1759356000000/4A4AD1wOHcyKP3xyaPbr7g/ovRWdFxmBfXwgt3vFeL2K5v4k3kRnFDj3WaPdDdaNnOddPPdy1mo4SmYH-Qk-P8XjpB0Byep0eY5QwB9rYWzbIr8vs6p6OGLg52fhJLdsZTLhAYPsDtEgj0GhRVc5rZBty_x6GKUvH_liT6c-cj5WOiKQhHUnL-FNJXdN5QHnJ-uouaVudRhi53UyqddIU9Z/_ae9AsZiYOi5kLiROQ_4wyoP5Z_mAtHUg70i8QLFnuM),"18-gauge brad nailer, nail capacity 15–50 mm, lightweight design for woodworking.",INR 3500.00,,11,Spark Pneumatics,,"Brad nailer, 18-gauge, woodworking",Lightweight nailer used for woodworking and finishing tasks like cabinets and small furniture.,https://res.cloudinary.com/dkse0bpnm/image/upload/v1759342140/omxsuefgfjbpwtlqcghg.jpg
Brad Nails (F series),F-series,Nails,29151246-8615-4459-B478-1170B1B2FD13.jpeg (https://v5.airtableusercontent.com/v3/u/45/45/1759356000000/Mn2TRj8Yo5BVhxl0lqNuNQ/N0qlYFwNd8JdBfj_9vuvHax1lB8arXvWG_OX1_RwRvm4VW7I0rU9z1_lHurVjrT54A-zs6ySeiMi-svH5Ej6KXWpqhs28TqMgCaMsL_GVW6_9lfHw4iTJUigYyg-TPEfJ3G5aw5n3s-sMgIR8n7z604N5biD9O71G3uNMnZ1RcldHV34QKqEjR2-7GJ_sz7m/NPfSLgAD1A-qFglEFyvOhZzyLhSWPjqrOipEGML-KhE),"18-gauge brad nails, 10–50 mm sizes available.",INR 0.00,"Less than 1 carton → No discount, Customer: ≥ 1 carton → 5% discount, Dealer: ≥ 1 carton → 10% discount",12,Spark Pneumatics,,"F-series brad nails, 18-gauge","Consumable brad nails for F-series nailers, used in furniture and trim work applications.",https://res.cloudinary.com/dkse0bpnm/image/upload/v1759342141/wrysllg8mvaiwui3clfp.jpg
Air Brad Nailer F32,F32,Nailer,12926845-F398-464A-9486-B978EE88EA5A.jpeg (https://v5.airtableusercontent.com/v3/u/45/45/1759356000000/8DqiJ6ttO_nDczVNCL0LrA/0e_7cUeyIO1bi6RT9iM_Z64-n6UyTysHml_28zcBKTIIMXB7EXf0nRjT0TSG6vYLSM-5gxoez4fvsWn_DVq9FVHzIy0jkTj3oiQwORE3LZgWPhio1W-qBBz_JaMEL7ya74AtZWq7ivaOqixgH_ASbnenFvLu8pm0EcMR6h_BtiX_fu-hNOZe6w0jsK-VkNXO/Wf1HMLWYjPSZIWZOamNOl9M8FXEwthD1_l2sBXgYAsM),"18-gauge brad nailer, nail capacity 10–32 mm, precision nailing for furniture/carpentry.",INR 2800.00,,13,Spark Pneumatics,,"Brad nailer, precision carpentry",Ideal for furniture making and carpentry where precision nailing is required on thin wood sections.,https://res.cloudinary.com/dkse0bpnm/image/upload/v1759342142/jzmbdsk0oj5dz8k0gdyy.jpg
Air Stapler N851,N851 Spark,Stapler,F1D0B406-E460-4F73-B7F9-38D523CD158D.jpeg (https://v5.airtableusercontent.com/v3/u/45/45/1759356000000/Vxoyio8YNwrv2T-zjlaohg/rdd9-opqAgbprnHzbnRZyl5vdjjNZUG68SxOCftk5QM2FyeIdPwNRN4G5jTaVrBKQzE4lpfrsjYKg3-ptwO6d7Jt7MBpc-GKwOYhP8pw-3dJsZxWp-1T-mGBSPTiZ_2yIdXHI8f64hZDmpIu-ggt-8ILb-fEhuBkZhHUn1bnGaoFquhw1LLz2xaqUZcNLgT9/Z_62zsUhK9SGXc6eikfvaAmnzIV5SIhtHO2BXYpo5Bo),"Industrial stapler with 360° exhaust, jam-free system, supports 16–50 mm staples.",INR 10400.00,,14,Spark Pneumatics,,"Stapler, industrial heavy use","Industrial stapler used for heavy-duty packaging, upholstery, and furniture manufacturing.",https://res.cloudinary.com/dkse0bpnm/image/upload/v1759342143/jyinpvpqqdjvenokrdke.jpg
Air Stapler 9025,9025,Stapler,0F2235C9-E144-4F02-BF26-768E83C40295.jpeg (https://v5.airtableusercontent.com/v3/u/45/45/1759356000000/-NNh1QXtIqs7-wzcj4EpXg/txWoYd_4l-1pAWs2dIlDAQGtuMZ7tzKAmEropTqabtjWq4mI3XUM62f0h1owPG15AZi_ZxLwE1gB5hzL-Ca30BgBgdnky8JRWXI_NfExM0eLla0vNCTaNx2vTugC6QPXSJ79gr0wkRM53BuOPrTrBPa10Um5yqJftVAVJFXuZ4illLvbFwQ-y4cQBnKZU5Vj/hN1vGWGN13-ZQPLuDmtfNfZKoiIWVWaSj6PXc9zyTa0),Compatible with 22 GA staples (9–25 mm). Lightweight with rubber grip for upholstery.,INR 6000.00,,15,Spark Pneumatics,,"Stapler, upholstery","Commonly used in upholstery and light woodwork, especially for furniture repair and assembly.",https://res.cloudinary.com/dkse0bpnm/image/upload/v1759342144/urkk1nqaskbhtxpbhh7f.jpg
Air Stapler 8016,Spark 80/16,Stapler,9CE26EF4-2D24-40C5-801E-446DE25A7561.jpeg (https://v5.airtableusercontent.com/v3/u/45/45/1759356000000/Z2OSrxi25xYhRHHR-9ulsg/XZpucEAod_RFRN_B1FpO1w5JH3g37gB5lo4PkVa24jrRhSJUhife6RYkAd0zoCKm8kyd4AIQu3Rwrwl1jApgPJtc9q0OLCfLwG71gYihsg2dZoKRxn598rRirg9-XTLl4XKYzGHdI_GsjRnk9VMqt7eSxJ-an33C5KTaLjFMjIaEB4-unH1yUZdoH5k6e6qm/e-cTJKMR65dlI8bR9nuLGzz4TOuTmuIYgVKCJvS18lQ),"21-gauge air stapler for upholstery, 150-staple magazine, compact design.",INR 2800.00,,16,Spark Pneumatics,,"21-gauge stapler, upholstery","Compact stapler used in upholstery, interior finishing, and lightweight assembly jobs.",https://res.cloudinary.com/dkse0bpnm/image/upload/v1759342145/t5gink83ex5dg8xlp2lz.jpg
Air Screwdriver,4460,Screwdriver,4392D178-7485-4153-8970-CDC027ECED73.jpeg (https://v5.airtableusercontent.com/v3/u/45/45/1759356000000/r8LNzQy00P2vtQfQX8StjA/2gOIEoaPQWYJwUU990EuquN_eppOX4Tc05Ic-SozuzAnJsftm2Ia3orMhuJMfYDAyyGHKAJiRIvEWo7Ctw5pp4P1M57_SO-njmW5PzLi-ruqnHK5Vdotf-BfE1f-WHcVIuCMBnIcsWVaYYpsG2gfssRwsJD1_5G1vvCVJI68wjwDSQxBhEX5VI9AX3r9bRSQ/uUd6C9iN2ePmHsbGTvAcFvGjtnqYklOZtmWPXDE9K1k),"High-speed 1/4 screwdriver, 11000 RPM, compact/lightweight for precision fastening.",INR 2800.00,,17,Spark Pneumatics,,High-speed screwdriver,Designed for electronics assembly and fine mechanical fastening where high speed and precision are required.,https://res.cloudinary.com/dkse0bpnm/image/upload/v1759342146/vdbkne30qayujfntc2dr.jpg
Air Die Grinder,812,Grinder,FFA91E1B-59E8-4A21-81EA-A42736220BE9.jpeg (https://v5.airtableusercontent.com/v3/u/45/45/1759356000000/6NBeNCbhYqisZNmiO5SXiQ/Pr9B6V92R60UkHLADrNxKT-ch5YTJeUqQgF7RmdU1AXGsAt8gA4Xex1YPrpPAuJt89HJHA8IgwsZQqGADUYEW8f-rK95JdbAf4XBEcrMdm9AUcxP9bK7dWM7BTVmovP6ZSa4_g-gvPlGeLLOwK-u24gRBrf9E0H7NGR4zw0WhfZoFgPljQHtaX933R598Aqa/9sbnnMJaMT4wfFbeIaoJQWFVsWFNWh3Q07HnrXWOzdA),"22000 RPM die grinder for grinding and polishing, lightweight ergonomic body.",INR 1400.00,,18,Spark Pneumatics,,"Die grinder, polishing","Used in metal fabrication, polishing, and deburring where precision grinding is needed.",https://res.cloudinary.com/dkse0bpnm/image/upload/v1759342147/rjp1b4lg123bn6gqhde8.jpg
Air Butterfly Impact Wrench,DB-I-30,Impact Wrench,db-i-30.jpg (https://v5.airtableusercontent.com/v3/u/45/45/1759356000000/eMBZKYZvzMjHHFsEkDvqCA/BbsBP01OGgojiH1NEkMcDR6Si0HOLBrTC2SlBHLTabLE48V5vmTRx3-eO2kN2II3XvbUQeYcyVQh38EMtfkNWLzUQsCIrXibP6-Vbstq7cvsDHv-W3-fPyp6QnVqfWtZSU5izAhFbrM5jsdK34pg9JEoRimgjwyNvI1mlUEPa7E/QmUx6PkHRDx_dngmPCDdChigrC3DBEp3pxSPOZS3WRk),"Square Drive: 3/8; Capacity (Bolt Size): 3/8 / M10; Free Speed: 10,000 RPM; Max Torque: 75 Ft-Lb / 102 Nm; Overall Length: 5.1 / 139mm; Air Inlet: 1/4; Air Hose (ID): 3/8; Avg. Air Consumption: 2.5 cfm / 71 L/min; Net Weight: 0.8 kgs / 1.75 lbs",INR 3775.00,25% off,20,Drebon,," One hammer, Impact wrench, torque tool, pneumatic tool","Used for tightening and loosening bolts and nuts in automotive, assembly, and maintenance applications.",https://res.cloudinary.com/dkse0bpnm/image/upload/v1759342149/mp9n2xb5rgiupopvvmno.jpg
Air Butterfly Impact Wrench,DB-I-32,Impact Wrench,db.jpg (https://v5.airtableusercontent.com/v3/u/45/45/1759356000000/lvp1eizRy0fOsvY6cphkqA/HmYk4sK-qKo819nt_cpbdswJYSNhluiqRxn5B3hPIcRiP54JfcZDSJ-R-Z63nfyQlq6gFr-BIJ0BDIRzgf7ksfDkYu6xj7WcwEbxN2XzW9kcl5fHhzlI6EPR3J0jRf_la1IyFwzK5GXn5YnWMDLVb6CQZTq7BbsrzfjRHBpH_dE/tyu3EPgPPfeakHu3FqRoeW1nJE3bZPtip3eNz-0opQw),"Square Drive: 3/8, Capacity (Bolt Size): 9/16 / 11mm, Free Speed (RPM): 9,500, Max Torque: 175Ft-Lb / 102NM, Overall Length: 6.1/2 / 220mm, Air Inlet (Pt/Npt): 1/4, Air Hose (ID): 3/8, Avg. Air Consumption: 6Cfm, Net Weight: 1.03Kgs / 2.30Lbs, Mechanism: Rocking Dog Mechanism",INR 6135.00,25% off,20,Drebon,,"Air Impact Wrench, Butterfly Impact Wrench, Rocking Dog Mechanism","A compact and lightweight 3/8 air impact wrench with a rocking dog mechanism, delivering 102Nm torque at 9,500 RPM, perfect for light to medium-duty fastening tasks in automotive and workshop applications.",https://res.cloudinary.com/dkse0bpnm/image/upload/v1759342149/rwybbxusfltv26buavwc.png
3/8 Impact Wrench,DB-I-350C,Impact Wrench,db-i-32.jpg (https://v5.airtableusercontent.com/v3/u/45/45/1759356000000/fVr0S6UIkaOwjTVbDUKXMg/2rQMDE8alxjfpZDreyn0Qs1H8o6bs01wnA62IA-uWC_PmWhP8C1yGeH9SKz07CGJkOXZHMZVjfVXHfdWSWfuztqHirODKrtHSJngRpI4Eyf_PIViGHVZ6MubNFdpWcvalrFekfQ2xZwyN6XX0yEq6tNispnWNWfD8LNFvPAAvXU/DQFR37-bocj6qhZDuS1YxNQ4y-LIDq6fpghaZ4k51xI),"Square Drive: 3/8, Capacity (Bolt Size): 1/2 / M12, Free Speed (RPM): 9,200, Max Torque: 384Ft-Lb/520NM, Overall Length: 5.1/2/139mm, Air Inlet (Pt/Npt): 1/4, Air Hose (ID): 3/8, Avg. Air Consumption: 2.5Cfm/71L/min, Net Weight: 1.60Kgs / 3.53Lbs",INR 5380.00,25% off,20,Drebon,,"Twin Hammer, Air Tool, Pneumatic Wrench, Fastener, Loosening, Tightening","Used for tightening and loosening nuts, bolts, and other fasteners with high torque.",https://res.cloudinary.com/dkse0bpnm/image/upload/v1759342150/tquwd8vb0b8zphn30v7l.png
3/8 Twin Hammer Air Impact Wrench,DB-I-AT321,Impact Wrench,db-i-32.jpg (https://v5.airtableusercontent.com/v3/u/45/45/1759356000000/Huzo4DkAw71Wri6guTt_Dw/thXcf5Hi4DknhraJq-F0_mgW3aYugyY0DBho2rlU2riIpZk9R2Z6amA9d4LyXkCx8ZlphuThGyFtlf-oeRm2lnM7UWCfi1rFpn5d1E1tOuJLR2cYUUqtH8o7z3XjgO2r3F9UUMnWfjhL66dpwboCqkzbx2Lj8rnedqWbzzKCX-s/I3b_wc-mgnWXNl3cwvSZH0sWizVvsg2Wjn2jrvYSWTs),"Square Drive: 3/8, Capacity (Bolt Size): M12, Free Speed (RPM): 9,000, Max Torque: 340Ft-Lb / 470Nm, Overall Length: 144mm, Air Inlet (Pt/Npt): 1/4, Air Hose (ID): 3/8, Avg. Air Consumption: 90PSI, Net Weight: 1.70KGS",INR 5305.00,25% off,20,Drebon,,"Twin Hammer, Air Impact Wrench, 3/8 inch, Impact, Wrench, Pneumatic","This is a 3/8 Twin Hammer Air Impact Wrench, suitable for applications requiring strong torque up to 340Ft-Lb.",https://res.cloudinary.com/dkse0bpnm/image/upload/v1759342151/qdm90tvkkiqyhjiokwhx.png
3/8 Industrial Air Impact Wrench,DB-I-AT360,Impact Wrench,db-i-32.jpg (https://v5.airtableusercontent.com/v3/u/45/45/1759356000000/sR78O__ZKgaieAiL8wv34A/qEb7b_UyHYU3-TCEbHwganvscG1ar4758XoeL_ovRFzG1Iq1c8gHNjTAPnRbmYeSn2M7_1FWBQG-U4TnzC-czKMU2PrriEmxgX3KNcbEEBGN778o8r9IHtteqYCPuoL3ub_mecpaCMdW3VPQ335Gl2CSiGfSpQhx2B0h_v_uQ-g/fx2hiUlVNZifbBz55Gt16irzFgSErfO0DVxMRu-HCrs),"Square Drive: 3/8, Capacity (Bolt Size): M14, Free Speed (RPM): 9,000, Max Torque: 380Ft-lb / 520Nm, Overall Length: 128mm, Air Inlet (Pt/Npt): 1/4, Air Hose (ID): 3/8, Avg. Air Consumption: 90PSI, Net Weight: 1.40KGS",INR 6857.00,25% off,20,Drebon,,"Industrial, Air, Impact Wrench, 3/8 inch, Pneumatic, High Torque",Designed for tightening and loosening bolts and nuts in industrial applications using compressed air.,https://res.cloudinary.com/dkse0bpnm/image/upload/v1759342152/oxi842qot7nepiytuxra.png
3/8 inch Impact Wrench (Single Hammer),DB-I-35,Impact Wrench,db.jpg (https://v5.airtableusercontent.com/v3/u/45/45/1759356000000/fQiBU5YGU04jb5efvU0t4A/VHz8yLz-rzJMGrDg34JiK67IR5jBnxiQU4kUrmJpaLL_rgSMiqgxHC_BHurwYzA1ZSSyFnmBlBU0oui00_0KZ1JLxUihVjLVfQ9sxPcg3nx3zY5UGUyKaBRDDZf5xZDkHjx1Xf5dna9eb5BsxGCanMYctqSydFFfR6m1gf73xqI/CJ-_gKjeIcD3mROkoWS8KV35oYeJ9xq_IVt0atBmXqY),"Square Drive: 3/8 inch, Capacity (Bolt Size): 3/8 inch / M10, Free Speed (RPM): 10,000, Max Torque: 200Ft-Lb/183NM, Overall Length: 5.1/2 inch / 139mm, Air Inlet (Pt/Npt): 1/4 inch, Air Hose (ID): 3/8 inch, Avg. Air Consumption: 2.5Cfm/71L/min, Net Weight: 1.35Kgs / 2.97Lbs",INR 7655.00,25% off,20,Drebon,,"Impact Wrench, Single Hammer, Pneumatic Wrench, Air Wrench, Torque Wrench",A pneumatic impact wrench designed for tightening and loosening bolts with a maximum torque of 200Ft-Lb.,https://res.cloudinary.com/dkse0bpnm/image/upload/v1759342153/tbauvktk1dhbllmjgo2q.png
3/8 inch Industrial Single Hammer Mechanism Impact Wrench,DB-OP-308I,Impact Wrench,db.jpg (https://v5.airtableusercontent.com/v3/u/45/45/1759356000000/payVl0U_UOuqI6t7YMaZtg/VWb1--8ec58-uH1KNwoGpPdPbwefAuuSUKMcE3yt-P62Px9nI5ln5XuC7YbtAQVJhQtKwilBZckNQl37bBGsYrOEQAReu03PCxJqjCtT1rW8Isy-8UBLmbhKDicZI7IAZjQ2nlGeMFHITNXov5vFHnWGoDxSFeneK0ycM0GdAxc/vtOLYiwkNweo_HlmJU7doPUx30CYE0FdPt4yZiCNhss),"Square Drive: 3/8 inch, Capacity (Bolt Size): M10, Free Speed (RPM): 8,100, Max Torque: 200Nm, Overall Length: 220mm, Air Inlet (Pt/Npt): 1/4 inch, Air Hose (ID): 1/4 inch, Avg. Air Consumption: 3Cfm / 113L/min, Net Weight: 1.32KGS",INR 10550.00,25% off,20,Drebon,,"Industrial Impact Wrench, Single Hammer, Air Wrench, Pneumatic Tool, High Torque, 3/8 inch drive, DB-OP-308I","This 3/8 inch industrial impact wrench features a single hammer mechanism, delivering up to 500Ft-Lb maximum torque for heavy-duty fastening and loosening applications. It operates at a free speed of 8,100 RPM and has a working maximum torque of 200Nm.",https://res.cloudinary.com/dkse0bpnm/image/upload/v1759342154/w02acxfyomi7cjbhweyk.png
1/2 Impact Wrench (Twin Hammer),DB-I-1650,Impact Wrench,db.jpg (https://v5.airtableusercontent.com/v3/u/45/45/1759356000000/g09YoznVeyUjMI89U74OEw/xKVeE-s4LlHtVUFuVF2FCjI6yxYW2G4v14yxRRd1psa8Tc4MAuFKDW8_xzfbsbToSAOP0VmReeBEL7fSrMXouoppcuIaM0sG0EsygnqqIJ7L20KyIk7GXp33TtIhigL8-e0HPVzNRoKpCmWLR-ACKBKRsZLn6dxshT3Jktc-jqA/Zd24Bg1p_Rvz1cXimvEPrC-dot7KVYmXq8kT7qfz40w),"Square Drive: 1/2, Capacity (Bolt Size): 3/4 / M20, Free Speed (RPM): 8,500, Max Torque: 1143Ft-Lb/1550NM, Overall Length: 5.1/2/139mm, Air Inlet (Pt/Npt): 1/4, Air Hose (ID): 3/8, Avg. Air Consumption: 2.5Cfm/71L/min, Net Weight: 2.10Kgs / 4.63Lbs",INR 4320.00,25% off,20,Drebon,,"New Product, Twin Hammer, Impact Wrench","A lightweight yet powerful 1/2 air impact wrench delivering up to 1550Nm torque at 8,500 RPM, ideal for fast and efficient tightening or loosening of heavy bolts up to M20 in automotive and industrial usecase.",https://res.cloudinary.com/dkse0bpnm/image/upload/v1759342155/jw8ffhsrjnq7jrwy5x1u.png
1/2 Impact Wrench (Twin Hammer),DB-I-1670,Impact Wrench,db-i-32.jpg (https://v5.airtableusercontent.com/v3/u/45/45/1759356000000/ZcbrPTJLN0mIONGi8K1wWg/LrQ8TGfvIaH6XDTBYMqGkf9pSoYqswPYWJY1SHeC5-1Iquyhm46Phw3rY-vddhV2Jj5eQ_5mKOy0NDs37nvqs5O5roZRthSAVGQHvLrpWDf0JVGwy_VpeAjzFJzaxixxch6CJH17PFkoMJ7om0x0_1Idn43RH0r4zNZNcl8o5DA/mejQLPO0QAdH-E4-oE07M1knQx_RDnGzJL2V4TpafjY),"Square Drive: 1/2, Capacity (Bolt Size): 3./4 / M20, Free Speed (RPM): 8,500, Max Torque: 1143Ft-Lb/1550NM, Overall Length: 5.1/2/139mm, Air Inlet (Pt/Npt): 1/4, Air Hose (ID): 3/8, Avg. Air Consumption: 2.5Cfm/71L/min, Net Weight: 2.60Kgs / 5.75Lbs",INR 4320.00,25% off,30,Drebon,,"Impact Wrench, Twin Hammer, Air Tool, Pneumatic Wrench","An air-powered impact wrench featuring a twin hammer mechanism, suitable for various fastening and unfastening tasks requiring high torque.",https://res.cloudinary.com/dkse0bpnm/image/upload/v1759342156/ltunktgydrqfrv7jyfks.png
1/2 Impact Wrench (Twin Hammer) WITH REAR EXHAUST,DB-I-1680,Impact Wrench,db-i-32.jpg (https://v5.airtableusercontent.com/v3/u/45/45/1759356000000/_R2ta8nimr6-yyq0haX5rw/XgHdE0FLgqi8KpLYMz9iDmRvyiLQY38Ol6eA__MIrOaEqjQpMzBdWc1tVnpBRvB4kDgiFGwyfy8RmwsZWWPOddmXx7H-MANqtRHKFgu-eNXxrlL3rb7ESn8O4Z9Ktl9ZuF2L9ZJVml66GwhKINVh_9XXM8olUzlLSZT_xXdorDI/um1wePsNfWKrsb-1Kui-TyBpynBxPRNu2VJ0wAAYkb4),"Square Drive: 1/2, Capacity (Bolt Size): 3/4 / M20, Free Speed (RPM): 8,500, Max Torque: 1217Ft-Lb / 1650NM, Overall Length: 5.1/2 / 139mm, Air Inlet (Pt/Npt): 1/4, Air Hose (ID): 3/8, Avg. Air Consumption: 2.5Cfm / 71L/min, Net Weight: 2.70Kgs / 5.95Lbs",INR 4520.00,25% off,30,Drebon,,"Impact Wrench, Twin Hammer, Rear Exhaust, Pneumatic, Air Tool, DB-I-1680",This 1/2 impact wrench with a twin hammer mechanism and rear exhaust is designed for tightening and loosening nuts and bolts with high torque.,https://res.cloudinary.com/dkse0bpnm/image/upload/v1759342158/bcbfj2txc9nbbedld0ul.png
1/2 Heavy Duty Air Impact Wrench,DB-I-1640,Impact Wrench,db-i-32.jpg (https://v5.airtableusercontent.com/v3/u/45/45/1759356000000/8If0AMVp5BDEiFYEXd34Bg/Cx2h8sT5_bS5jUCzlhjq4B5_D2nR-6gyIrWAl-hWK0m2tZpEZ7cQMwN6FGUtCJMY7KGQeax3vM9DCmLbLjInbrEmh_E8QoWJOFBeXfvUtb_ylufTia1lByMDYI3Kh3toiupQxcWHNmQEdifR3fz9UboCoT-cGFfcicUzadYsb_Y/SiuH7f4Qjg-ET_Z4T00rzCqqKdRsdCfv2cdXSV3N7jA),"Square Drive: 1/2, Capacity (Bolt Size): 3/8 / M16, Free Speed (RPM): 7,000, Max Torque: 531Ft-Lb/720NM, Overall Length: 7.3/8/193mm, Air Inlet (Pt/Npt): 1/4, Air Hose (ID): 3/8, Avg. Air Consumption: 8Cfm, Net Weight: 2.30Kgs / 5.10Lbs",INR 4740.00,25% off,30,Drebon,,"Heavy Duty Air Impact Wrench, Impact Wrench, Air Tool, DB-I-1640","Used for fastening and loosening nuts and bolts in automotive, construction, or industrial applications.",https://res.cloudinary.com/dkse0bpnm/image/upload/v1759342159/ynanqtmv6n8ewqf2qpbk.png
1/2 Impact Wrench,DB-I-TU20B,Impact Wrench,db-i-32.jpg (https://v5.airtableusercontent.com/v3/u/45/45/1759356000000/MUqIEz93xo9GGK8raWb29w/dSYvYN1gWPqtUkm-S9NO1x-FwpSUeCRTR_93eM6HP8hsLtWIXK3AOQwbyRM751cQ0csajadlO6oka1i2_FlDAg1NtVVxm_FXvv8VFBUiPi2tPhJoLC4uD8sxpMGEC4hkXt-laGPIVlmsJqxFMiEBjIxB8uMtLYNBazmLm-tDG5Q/bjkA2TEaOC4FRFZjSle-b1UkYD0JbVIpJQaiDSCyBwY),"Square Drive: 1/2, Capacity (Bolt Size): 1/2 / M12, Free Speed (RPM): 9,800, Max Torque: 442Ft-Lb/600NM, Overall Length: 5.1/2/139mm, Air Inlet (Pt/Npt): 1/4, Air Hose (ID): 3/8, Avg. Air Consumption: 2.5Cfm/71L/min, Net Weight: 1.10Kgs / 2.42Lbs",INR 5460.00,25% off,30,Drebon,,"Impact Wrench, Twin Hammer, Composite Handle, High Torque, New Product","Powerful 1/2 inch impact wrench with twin hammer mechanism and composite handle, designed for various fastening applications requiring high torque.",https://res.cloudinary.com/dkse0bpnm/image/upload/v1759342159/cz6eavmz9pfconkcxpdd.png
Impact Wrench,DB-IW-601D,Impact Wrench,db-i-32.jpg (https://v5.airtableusercontent.com/v3/u/45/45/1759356000000/807x3UL4DT4AKzuHqIi_KQ/JuqH3uH85m1c-Y4-20vQTB80dZRQhYb9YI7c5NYYgU6O1hcJVM0Kl46y-pTjsiXqRs_lk50ssQiAw3qql3tF35sZFyZ8VoxUsMirxUSj7zceH5mnJQPN_png2Q0f0rr7lc2C4FM-3qUJpxK22JuFeM21U63n9wIB42Bkr33JPo0/oNfQhlWgvVqBx-BDiaB-YtPoyopXlcqOULzi5w188eA),"Square Drive: 3/8, Capacity (Bolt Size): 5/8 / M16, Free Speed (RPM): 9,000, Max Torque: 258Ft-Lb/350NM, Overall Length: mm, Air Inlet (Pt/Npt): 1/4, Air Hose (ID): 3/8, Avg. Air Consumption: 8Cfm, Net Weight: 2.00Kgs / 4.41Lbs",INR 5200.00,25% off,30,Drebon,,"Impact Wrench, Pneumatic, Air Tool, DB-IW-601D",Used for tightening and loosening nuts and bolts with high torque.,https://res.cloudinary.com/dkse0bpnm/image/upload/v1759342160/nvjqm4rmnqnhcfzdqgvm.png
